key,title,year,month,day,journal,issn,volume,issue,pages,authors,url,language,publisher,location,abstract,notes,doi,keywords,pubmed_id,pmc_id
rayyan-296973958,Can {Herbivore} {Management} {Increase} the {Persistence} of {Indo}-{Pacific} {Coral} {Reefs}?,2019,,,Frontiers in Marine Science,22967745,6,,,"Williams, I.D. and Kindinger, T.L. and Couch, C.S. and Walsh, W.J. and Minton, D. and Oliver, T.A.",https://www.scopus.com/inward/record.uri?eid=2-s2.0-85072886253&doi=10.3389%2ffmars.2019.00557&partnerID=40&md5=3c25499663bda4ab02fdc880206c28df,English,,,"Due to climate change, coral reefs have experienced mass bleaching, and mortality events in recent years. Although coral reefs are unlikely to persist in their current form unless climate change can be addressed, local management can have a role to play by extending the time frame over which there are functional reef systems capable of recovery. Here we consider the potential application of one form of local management – management of herbivorous fishes. The premise behind this approach is that increased herbivory could shift reef algal assemblages to states that are benign or beneficial for corals, thereby increasing corals’ ability to recover from destructive events such as bleaching and to thrive in periods between events. With a focus on Indo-Pacific coral reefs, we review what is known about the underlying processes of herbivory and coral-algal competition that ultimately affect the ability of corals to grow, persist, and replenish themselves. We then critically assess evidence of effectiveness or otherwise of herbivore management within marine protected areas (MPAs) to better understand why many MPAs have not improved outcomes for corals, and more importantly to identify the circumstances in which that form of management would be most likely to be effective. Herbivore management is not a panacea, but has the potential to enhance coral reef persistence in the right circumstances. Those include that: (i) absent management, there is an “algal problem” – i.e., insufficient herbivory to maintain algae in states that are benign or beneficial for corals; and (ii) management actions are able to increase net herbivory. As increased corallivory is a potentially widespread negative consequence of management, we consider some of the circumstances in which that is most likely to be a problem as well as potential solutions. Because the negative effects of certain algae are greatest for coral settlement and early survivorship, it may be that maintaining sufficient herbivory is particularly important in promoting recovery from destructive events such as mass bleaching. Thus, herbivore management can have a role to play as part of a wider strategy to manage and reduce the threats that currently imperil coral reefs. © Copyright © 2019 Williams, Kindinger, Couch, Walsh, Minton and Oliver.","Publisher: Frontiers Media S.A. | RAYYAN-INCLUSION: {""Samantha""=>""Included""} | RAYYAN-LABELS: extracted",,coral reef;climate change;herbivory;algae;parrotfish;marine protected areas;Indo-Pacific;coral resilience,,
rayyan-296973961,"The past, present, and future of coral heat stress studies",2019,,,Ecology and Evolution,20457758,9,17,10055--10066,"Cziesielski, M.J. and Schmidt-Roach, S. and Ar and a, M.",https://www.scopus.com/inward/record.uri?eid=2-s2.0-85070913664&doi=10.1002%2fece3.5576&partnerID=40&md5=3e00c61a9dc99e9e9f4a5ea470bf97e8,English,,,"The global loss and degradation of coral reefs, as a result of intensified frequency and severity of bleaching events, is a major concern. Evidence of heat stress affecting corals through loss of symbionts and consequent coral bleaching was first reported in the 1930s. However, it was not until the 1998 major global bleaching event that the urgency for heat stress studies became internationally recognized. Current efforts focus not only on examining the consequences of heat stress on corals but also on finding strategies to potentially improve thermal tolerance and aid coral reefs survival in future climate scenarios. Although initial studies were limited in comparison with modern technological tools, they provided the foundation for many of today's research methods and hypotheses. Technological advancements are providing new research prospects at a rapid pace. Understanding how coral heat stress studies have evolved is important for the critical assessment of their progress. This review summarizes the development of the field to date and assesses avenues for future research. © 2019 The Authors. Ecology and Evolution published by John Wiley \& Sons Ltd.","Publisher: John Wiley and Sons Ltd | RAYYAN-INCLUSION: {""Samantha""=>""Included""} | RAYYAN-LABELS: extracted",,bleaching;climate change;acclimatization;adaptation;heat stress;corals;Hot Temperature,,
rayyan-296973969,Nutrient {Availability} and {Metabolism} {Affect} the {Stability} of {Coral}–{Symbiodiniaceae} {Symbioses},2019,,,Trends in Microbiology,0966842X,27,8,678--689,"Morris, L.A. and Voolstra, C.R. and Quigley, K.M. and Bourne, D.G. and Bay, L.K.",https://www.scopus.com/inward/record.uri?eid=2-s2.0-85064184727&doi=10.1016%2fj.tim.2019.03.004&partnerID=40&md5=e180f3d2ebbc1352e2eaecf1b1496327,English,,,"Coral reefs rely upon the highly optimized coral–Symbiodiniaceae symbiosis, making them sensitive to environmental change and susceptible to anthropogenic stress. Coral bleaching is predominantly attributed to photo-oxidative stress, yet nutrient availability and metabolism underpin the stability of symbioses. Recent studies link symbiont proliferation under nutrient enrichment to bleaching; however, the interactions between nutrients and symbiotic stability are nuanced. Here, we demonstrate how bleaching is regulated by the forms and ratios of available nutrients and their impacts on autotrophic carbon metabolism, rather than algal symbiont growth. By extension, historical nutrient conditions mediate host–symbiont compatibility and bleaching tolerance over proximate and evolutionary timescales. Renewed investigations into the coral nutrient metabolism will be required to truly elucidate the cellular mechanisms leading to coral bleaching. © 2019 The Authors","Publisher: Elsevier Ltd | RAYYAN-INCLUSION: {""Samantha""=>""Included""} | RAYYAN-LABELS: extracted",,bleaching;animal;Animals;Carbon;coral;nonhuman;review;Anthozoa;metabolism;microbiology;physiology;symbiosis;symbiont;sea;carbon;dinoflagellate;development and aging;growth;heat tolerance;Symbiosis;Thermotolerance;Nutrients;phosphorus;Dinoflagellida;warming;Microbiota;microflora;algal cell culture;carbon metabolism;nutrient availability;Phosphorus;Food,,
rayyan-296973985,A review of interventions proposed to abate impacts of ocean acidification on coral reefs,2019,,,Regional Studies in Marine Science,23524855,29,,,"Albright, R. and Cooley, S.",https://www.scopus.com/inward/record.uri?eid=2-s2.0-85064312273&doi=10.1016%2fj.rsma.2019.100612&partnerID=40&md5=7b99854b3dbace748acce00c53ad5f04,English,,,"Coral reefs experiencing ocean acidification (OA) are likely to recover much more slowly from damage caused by acute events such as mass bleaching because OA slows coral reef growth and reproduction. To maintain reefs in a net growth or net-neutral condition, curbing the impact of OA is therefore necessary. A variety of mitigation and adaptation strategies have been proposed to abate OA impacts on reefs. However, detailed guidance for managers on the types, effectiveness, or costs of different local interventions to address OA is scarce. To advance the discussion about available interventions, this review explores and compares mitigation and adaptation techniques that have been proposed to abate OA impacts on coral reefs. We focus primarily on four categories of interventions intended to address different ecosystem service changes: phytoremediation, chemical remediation, reef restoration, and assisted evolution. We briefly touch on traditional restoration methods like marine protected areas (MPAs) and reducing secondary sources of stress. Of the techniques reviewed, most are costly and do not scale at the same pace as global reef loss. Nor do they address the root cause of OA, global carbon emissions. That said, intervention should not be an all or nothing approach; some techniques may be worth implementing at smaller scales in a coordinated way. Working to save pieces of ecosystems and buying time may help ensure that there is more to rebuild from in the future. Despite the seemingly high price tag of many of these techniques, given the potential value of regained ecosystem services, net gains may exceed implementation costs. It is certain, however, from the limited reach of coral reef interventions, that they must be undertaken as part of a suite of global-scale interventions including atmospheric CO 2 reduction to preserve coral reef ecosystem function and benefits to humanity. © 2019 Elsevier B.V.","Publisher: Elsevier B.V. | RAYYAN-INCLUSION: {""Samantha""=>""Included""} | RAYYAN-LABELS: extracted",,,,
rayyan-296973992,Recent progress on signalling molecules of coral-associated microorganisms,2019,,,Science China Earth Sciences,16747313,62,4,609--618,"Tang, K. and Wang, Y. and Wang, X.",https://www.scopus.com/inward/record.uri?eid=2-s2.0-85062678393&doi=10.1007%2fs11430-018-9332-1&partnerID=40&md5=1be6b17d3de4602b469870846ebed013,English,,,"Coral reefs have high primary productivity and are one of the most important ecosystems in the ocean. However, the health and stability of coral reefs are constantly threatened by climate change and human activities. The coral holobiont is a complex symbiosis between the coral animal, zooxanthellae, and the associated community of microorganisms including bacteria, archaea, viruses, etc. Coral-associated microorganisms are found to be important for the maintenance of coral health, and they are proposed to contribute to the acclimatization and adaptation of reef-building corals under rapid climate change. The coral-microbe interaction mediated by chemical signalling molecules is an important driving force for shaping the microbial communities. Herein, we summarize our current knowledge of the chemical signalling molecules involved in the interaction of the coral holobiont. Specifically, the cooperation and competition among microbes mediated by N-acyl homoserine lactones (AHLs), the interrelationship between microbes and hosts mediated by dimethylsulfoniopropionate (DMSP) and nitric oxide (NO), and the response of corals and microorganisms to reactive oxygen species (ROS) under environmental stresses are highlighted in this review. We further discuss the potential of manipulating the coral microbiome using signalling molecules to restore and protect coral reefs. © 2019, Science China Press and Springer-Verlag GmbH Germany, part of Springer Nature.","Publisher: Science in China Press | RAYYAN-INCLUSION: {""Samantha""=>""Included""} | RAYYAN-LABELS: extracted",,coral reef;climate change;Climate change;environmental stress;Reefs;Anthozoa;nitric oxide;Bacteria;Bacteria (microorganisms);microorganism;Molecules;Animalia;acclimation;gene expression;Amino acids;Cooperation and competitions;dimethylsulfoniopropionate;Dimethylsulfoniopropionate;DMSP;Microbiome;N-Acyl Homoserine lactones;Nitric oxide;Quorum-sensing;reactive oxygen species;Reactive oxygen species;signaling;Signalling molecules;Viruses;Coral microbiome;Coral-associated microorganisms;Quorum sensing;Reef-building coral,,
rayyan-296973993,Modes of coral disease transmission: how do diseases spread between individuals and among populations?,2019,,,Marine Biology,253162,166,4,,"Shore, A. and Caldwell, J.M.",https://www.scopus.com/inward/record.uri?eid=2-s2.0-85062150411&doi=10.1007%2fs00227-019-3490-8&partnerID=40&md5=fca67d3feabfe063d86c7c58a82da705,English,,,"Coral disease is considered an important factor in the recent decline of coral reefs worldwide; yet transmission, a critical factor for understanding disease ecology, identifying at-risk individuals and populations, and developing management options, is understudied in coral disease research. Here, we review techniques for investigating coral disease transmission using laboratory and field experiments, and modeling analyzes, and highlight how these approaches can improve our understanding of disease ecology. We summarize current knowledge about three hypothesized modes of coral disease transmission: direct contact, water borne, and vector-borne transmission. We also discuss the key challenge in studying disease transmission, which is unknown or complex etiology. Finally, we suggest potential management strategies that may result from a better understanding of coral disease transmission. © 2019, Springer-Verlag GmbH Germany, part of Springer Nature.","Publisher: Springer Verlag | RAYYAN-INCLUSION: {""Samantha""=>""Included""} | RAYYAN-LABELS: extracted",,marine ecosystem;disease transmission;coral;Anthozoa;population decline;literature review;experimental study;disease control;disease spread;disease vector;etiology;Coral disease;Disease ecology;Marine disease;Transmission;Vector borne;Water borne,,
rayyan-296973994,Status of coral-{Symbiodiniaceae} research in {Western} {Indian} {Ocean},2019,,,Symbiosis,3345114,77,3,207--215,"Chauka, L.J. and Macdonald, A.H.H.",https://www.scopus.com/inward/record.uri?eid=2-s2.0-85057629513&doi=10.1007%2fs13199-018-0584-x&partnerID=40&md5=352a42226dce5ea438d0866612cb57bb,English,,,"Underpinning the success of coral reefs in nutrient poor marine environments is mutualism established between corals and members of the phylum Symbiodiniaceae. In recent decades, reef-building corals have been affected by multiple stressors including bleaching, which results largely from elevated sea surface temperature and exposure to excessive solar radiation, ultimately caused by global warming. Accumulating evidence demonstrates differential resistance to bleaching among coral-Symbiodiniaceae partnerships; encouraging studies on the diversity and phylogenetics of Symbiodiniaceae. Examination of the existing knowledge reveals insights into both longitudinal and latitudinal partitioning of members of Symbiodiniaceae at genus level, throughout the Western Indian Ocean (WIO). Contrary to expectations, due to decreasing sea surface temperature with latitude, this review has revealed an increase of polymorphic symbioses involving bleaching susceptible coral genera with latitude. This could partly explain the low impacts of bleaching episodes in the South Western Indian Ocean. In order to substantiate this, we suggest long term monitoring of coral-Symbiodiniaceae symbioses in the WIO region. Such monitoring should take advantage of genetic approaches that can decipher the fine scale diversity of Symbiodiniaceae in coral tissues within a changing climate. © 2018, Springer Nature B.V.","Publisher: Springer Netherlands | RAYYAN-INCLUSION: {""Samantha""=>""Included""} | RAYYAN-LABELS: extracted",,coral reef;coral;latitude;Anthozoa;sea surface temperature;Indian Ocean;symbiosis;coral bleaching;global warming;Bleaching;Symbiodiniaceae;monitoring;mutualism;Indian Ocean (West);Western Indian Ocean;Reef building corals,,
rayyan-296973999,The future of resilience-based management in coral reef ecosystems,2019,,,Journal of Environmental Management,3014797,233,,291--301,"Mcleod, E. and Anthony, K.R.N. and Mumby, P.J. and Maynard, J. and Beeden, R. and Graham, N.A.J. and Heron, S.F. and Hoegh-Guldberg, O. and Jupiter, S. and MacGowan, P. and Mangubhai, S. and Marshall, N. and Marshall, P.A. and McClanahan, T.R. and Mcleod, K. and Nyström, M. and Obura, D. and Parker, B. and Possingham, H.P. and Salm, R.V. and Tamel and er, J.",https://www.scopus.com/inward/record.uri?eid=2-s2.0-85059636578&doi=10.1016%2fj.jenvman.2018.11.034&partnerID=40&md5=91640c1da51a5939af9605322bd317ae,English,,,"Resilience underpins the sustainability of both ecological and social systems. Extensive loss of reef corals following recent mass bleaching events have challenged the notion that support of system resilience is a viable reef management strategy. While resilience-based management (RBM) cannot prevent the damaging effects of major disturbances, such as mass bleaching events, it can support natural processes that promote resistance and recovery. Here, we review the potential of RBM to help sustain coral reefs in the 21st century. We explore the scope for supporting resilience through existing management approaches and emerging technologies and discuss their opportunities and limitations in a changing climate. We argue that for RBM to be effective in a changing world, reef management strategies need to involve both existing and new interventions that together reduce stress, support the fitness of populations and species, and help people and economies to adapt to a highly altered ecosystem. © 2018 The Authors","Publisher: Academic Press | RAYYAN-INCLUSION: {""Samantha""=>""Included""} | RAYYAN-LABELS: extracted",,coral reef;climate change;Coral Reefs;ecosystem;Ecosystem;animal;Animals;human;review;coastal zone;Anthozoa;reef;environmental management;coral bleaching;climate;ecosystem resilience;stress;Climate;economic aspect;fitness,,
rayyan-296974007,Corallivory in the anthropocene: {Interactive} effects of anthropogenic stressors and corallivory on coral reefs,2019,,,Frontiers in Marine Science,22967745,5,,,"Rice, M.M. and Ezzat, L. and Burkepile, D.E.",https://www.scopus.com/inward/record.uri?eid=2-s2.0-85059748504&doi=10.3389%2ffmars.2018.00525&partnerID=40&md5=5a9343d8339aed47bc43333f68598f77,English,,,"Corallivory is the predation of coral mucus, tissue, and skeleton by fishes and invertebrates, and a source of chronic stress for many reef-building coral species. Corallivores often prey on corals repeatedly, and this predation induces wounds that require extensive cellular resources to heal. The effects of corallivory on coral growth, reproduction, and community dynamics are well-documented, and often result in reduced growth rates and fitness. Given the degree of anthropogenic pressures that threaten coral reefs, it is now imperative to focus on understanding how corallivory interacts with anthropogenic forces to alter coral health and community dynamics. For example, coral bleaching events that stem from global climate change often reduce preferred corals species for many corallivorous fishes. These reductions in preferred prey may result in declines in populations of more specialized corallivores while more generalist corallivores may increase. Corallivory may also make corals more susceptible to thermal stress and exacerbate bleaching. At local scales, overfishing depletes corallivorous fish stocks, reducing fish corallivory and bioerosion, whilst removing invertivorous fishes and allowing population increases in invertebrate corallivores (e.g., urchins, Drupella spp.). Interactive effects of local stressors, such as overfishing and nutrient pollution, can alter the effect of corallivory by increasing coral-algal competition and destabilizing the coral microbiome, subsequently leading to coral disease and mortality. Here, we synthesize recent literature of how global climate change and local stressors affect corallivore populations and shape the patterns and effect of corallivory. Our review indicates that the combined effects of corallivory and anthropogenic pressures may be underappreciated and that these interactions often drive changes in coral reefs on scales from ecosystems to microbes. Understanding the ecology of coral reefs in the Anthropocene will require an increased focus on how anthropogenic forcing alters biotic interactions, such as corallivory, and the resulting cascading effects on corals and reef ecosystems. © 2019 Rice, Ezzat and Burkepile.","Publisher: Frontiers Media S.A. | RAYYAN-INCLUSION: {""Samantha""=>""Included""} | RAYYAN-LABELS: extracted",,overfishing;global climate change;Acanthaster spp.;butterflyflshes;corallivory;nutrient pollution;parrotfishes,,
rayyan-296974008,"Climate change, coral loss, and the curious case of the parrotfish paradigm: {Why} don't marine protected areas improve reef resilience?",2019,,,Annual Review of Marine Science,19411405,11,,307--334,"Bruno, J.F. and Côté, I.M. and Toth, L.T.",https://www.scopus.com/inward/record.uri?eid=2-s2.0-85059494455&doi=10.1146%2fannurev-marine-010318-095300&partnerID=40&md5=5cb5d26e11ce40bed5e6f6e6644248e7,English,,,"Scientists have advocated for local interventions, such as creating marine protected areas and implementing fishery restrictions, as ways to mitigate local stressors to limit the effects of climate change on reef-building corals. However, in a literature review, we find little empirical support for the notion of managed resilience. We outline some reasons for why marine protected areas and the protection of herbivorous fish (especially parrotfish) have had little effect on coral resilience. One key explanation is that the impacts of local stressors (e.g., pollution and fishing) are often swamped by the much greater effect of ocean warming on corals. Another is the sheer complexity (including numerous context dependencies) of the five cascading links assumed by the managed-resilience hypothesis. If reefs cannot be saved by local actions alone, then it is time to face reef degradation head-on, by directly addressing anthropogenic climate change - the root cause of global coral decline. © Copyright 2019 by Annual Reviews. All rights reserved.","Publisher: Annual Reviews Inc. | RAYYAN-INCLUSION: {""Samantha""=>""Included""} | RAYYAN-LABELS: extracted",,coral reef;climate change;Climate change;Climate Change;Coral reef;Coral Reefs;animal;Animals;Reefs;fish;Fisheries;fishery;Anthozoa;Fishes;environmental protection;Environmental protection;procedures;Conservation;conservation management;coral bleaching;Conservation of Natural Resources;development and aging;growth;ecosystem resilience;marine park;perciform;Marine protected area;environmental planning;environmental disturbance;Anthropogenic climate changes;Context dependency;disturbance;Electric resistance;Literature reviews;parrotfish;resilience;Scaridae;stress resistance;Military Personnel,,
rayyan-296974014,Coral reef resilience in {Taiwan}: {Lessons} from long-term ecological research on the coral reefs of {Kenting} {National} {Park} ({Taiwan}),2019,,,Journal of Marine Science and Engineering,20771312,7,11,,"Keshavmurthy, S. and Kuo, C.-Y. and Huang, Y.-Y. and Carballo-Bolaños, R. and Meng, P.-J. and Wang, J.-T. and Chen, C.A.",https://www.scopus.com/inward/record.uri?eid=2-s2.0-85075642993&doi=10.3390%2fjmse7110388&partnerID=40&md5=cff27cbfbe27621f7ff6d134168ec40a,English,,,"Coral reefs in the Anthropocene are being subjected to unprecedented levels of stressors, including local disturbances-such as overfishing, habitat destruction, and pollution-and large-scale destruction related to the global impacts of climate change-such as typhoons and coral bleaching. Thus, the future of corals and coral reefs in any given community and coral-Symbiodiniaceae associations over time will depend on their level of resilience, from individual corals to entire ecosystems. Herein we review the environmental settings and long-term ecological research on coral reefs, based on both coral resilience and space, in Kenting National Park (KNP), Hengchun Peninsula, southern Taiwan, wherein fringing reefs have developed along the coast of both capes and a semi-closed bay, known as Nanwan, within the peninsula. These reefs are influenced by a branch of Kuroshio Current, the monsoon-induced South China Sea Surface Current, and a tide-induced upwelling that not only shapes coral communities, but also reduces the seawater temperature and creates fluctuating thermal environments which over time have favoured thermal-resistant corals, particularly those corals close to the thermal effluent of a nuclear power plant in the west Nanwan. Although living coral cover (LCC) has fluctuated through time in concordance with major typhoons and coral bleaching between 1986 and 2019, spatial heterogeneity in LCC recovery has been detected, suggesting that coral reef resilience is variable among subregions in KNP. In addition, corals exposed to progressively warmer and fluctuating thermal environments show not only a dominance of associated, thermally-tolerant Durusdinium spp. but also the ability to shuffle their symbiont communities in response to seasonal variations in seawater temperature without bleaching. We demonstrate that coral reefs in a small geographical range with unique environmental settings and ecological characteristics, such as the KNP reef, may be resilient to bleaching and deserve novel conservation efforts. Thus, this review calls for conservation efforts that use resilience-based management programs to reduce local stresses and meet the challenge of climate change. © 2019 by the authors.","Publisher: MDPI AG | RAYYAN-INCLUSION: {""Samantha""=>""Included""} | RAYYAN-LABELS: extracted",,community dynamics;coral reef;Symbiodiniaceae;Taiwan;nuclear power plant;long-term ecological data;marine national park;Coral Reefs;Anthozoa,,
