key,title,year,month,day,journal,issn,volume,issue,pages,authors,url,language,publisher,location,abstract,notes,doi,keywords,pubmed_id,pmc_id
rayyan-296974372,Climate change influences on marine infectious diseases: {Implications} for management and society,2014,,,Annual Review of Marine Science,19411405,6,,249--277,"Burge, C.A. and Mark Eakin, C. and Friedman, C.S. and Froelich, B. and Hershberger, P.K. and Hofmann, E.E. and Petes, L.E. and Prager, K.C. and Weil, E. and Willis, B.L. and Ford, S.E. and Harvell, C.D.",https://www.scopus.com/inward/record.uri?eid=2-s2.0-84891856871&doi=10.1146%2fannurev-marine-010213-135029&partnerID=40&md5=3e915514bc8dc57096e29257141bbcfd,English,,,"Infectious diseases are common in marine environments, but the effects of a changing climate on marine pathogens are not well understood. Here we review current knowledge about how the climate drives host-pathogen interactions and infectious disease outbreaks. Climate-related impacts on marine diseases are being documented in corals, shellfish, finfish, and humans; these impacts are less clearly linked for other organisms. Oceans and people are inextricably linked, and marine diseases can both directly and indirectly affect human health, livelihoods, and well-being. We recommend an adaptive management approach to better increase the resilience of ocean systems vulnerable to marine diseases in a changing climate. Land-based management methods of quarantining, culling, and vaccinating are not successful in the ocean; therefore, forecasting conditions that lead to outbreaks and designing tools approaches to influence these conditions may be the best way to manage marine disease. Copyright © 2014 by Annual Reviews.","RAYYAN-INCLUSION: {""Samantha""=>""Included""} | RAYYAN-LABELS: extracted",,Oceanography;Marine environment;climate change;Climate change;Climate Change;marine environment;animal;Animals;human;Humans;article;adaptive management;global warming;mass mortality;Health;animal disease;host-pathogen interaction;infectious disease;vaccination;Adaptive Management;communicable disease;Communicable Diseases;Epizootics;food poisoning;Foodborne Diseases;Host-pathogen interactions;Infectious disease outbreaks;Mass mortality;Ocean warming;Oceans;Pathogens;Military Personnel,,
rayyan-296974374,"Microbes in the coral holobiont: {Partners} through evolution, development, and ecological interactions",2014,,,Frontiers in Cellular and Infection Microbiology,22352988,4,,,"Thompson, J.R. and Rivera, H.E. and Closek, C.J. and Medina, M.",https://www.scopus.com/inward/record.uri?eid=2-s2.0-84990976005&doi=10.3389%2ffcimb.2014.00176&partnerID=40&md5=1917b8681d02376aa0765aa6a8481d51,English,,,"In the last two decades, genetic and genomic studies have revealed the astonishing diversity and ubiquity of microorganisms. Emergence and expansion of the human microbiome project has reshaped our thinking about how microbes control host health - not only as pathogens, but also as symbionts. In coral reef environments, scientists have begun to examine the role that microorganisms play in coral life history. Herein we review the current literature on coral-microbe interactions within the context of their role in evolution, development, and ecology. We ask the following questions, first posed by McFall-Ngai et al., 2013 in their review of animal evolution, with specific attention to how coral-microbial interactions may be affected under future environmental conditions: 1) How do corals and their microbiome affect each other's genomes? 2) How does coral development depend on microbial partners? 3) How is homeostasis maintained between corals and their microbial symbionts? 4) How can ecological approaches deepen our understanding of the multiple levels of coral microbial interactions? Elucidating the role that microorganisms play in the structure and function of the holobiont is essential for understanding how corals maintain homeostasis and acclimate to changing environmental conditions. © 2014 Thompson, Rivera, Closek and Medina.","Publisher: Frontiers Media S.A. | RAYYAN-INCLUSION: {""Samantha""=>""Included""} | RAYYAN-LABELS: extracted",,bleaching;coral reef;ecosystem;coral;nonhuman;Anthozoa;Article;symbiosis;metamorphosis;symbiont;microbial community;carbon;holobiont;homeostasis;predation;alga;Symbiodinium;evolution;reproduction;planula;immune response;organismal interaction;colony formation;nitrogen fixation;gametogenesis;mucus;antibiosis;coral-microbial interaction;electrophile;interstitium;nutrient supply;phototroph;resource partitioning;sexual maturation;bacterial interactions;biological;pollution and global change,,
rayyan-296974375,The engine of the reef: {Photobiology} of the coral-algal symbiosis,2014,,,Frontiers in Microbiology,1664302X,5,,,"Roth, M.S.",https://www.scopus.com/inward/record.uri?eid=2-s2.0-84987806930&doi=10.3389%2ffmicb.2014.00422&partnerID=40&md5=1dba9e817074298f3aababeb0d3c45ed,English,,,"Coral reef ecosystems thrive in tropical oligotrophic oceans because of the relationship between corals and endosymbiotic dinoflagellate algae called Symbiodinium. Symbiodinium convert sunlight and carbon dioxide into organic carbon and oxygen to fuel coral growth and calcification, creating habitat for these diverse and productive ecosystems. Light is thus a key regulating factor shaping the productivity, physiology, and ecology of the coral holobiont. Similar to all oxygenic photoautotrophs, Symbiodinium must safely harvest sunlight for photosynthesis and dissipate excess energy to prevent oxidative stress. Oxidative stress is caused by environmental stressors such as those associated with global climate change, and ultimately leads to breakdown of the coral-algal symbiosis known as coral bleaching. Recently, large-scale coral bleaching events have become pervasive and frequent threatening and endangering coral reefs. Because the coral-algal symbiosis is the biological engine producing the reef, the future of coral reef ecosystems depends on the ecophysiology of the symbiosis. This review examines the photobiology of the coral-algal symbiosis with particular focus on the photophysiological responses and timescales of corals and Symbiodinium. Additionally, this review summarizes the light environment and its dynamics, the vulnerability of the symbiosis to oxidative stress, the abiotic and biotic factors influencing photosynthesis, the diversity of the coral-algal symbiosis, and recent advances in the field. Studies integrating physiology with the developing ""omics"" fields will provide new insights into the coral-algal symbiosis. Greater physiological and ecological understanding of the coral-algal symbiosis is needed for protection and conservation of coral reefs. © 2014 Roth.","Publisher: Frontiers Media S.A. | RAYYAN-INCLUSION: {""Samantha""=>""Included""} | RAYYAN-LABELS: extracted",,coral reef;Review;nonhuman;oxidative stress;photosynthesis;symbiosis;carotenoid;unclassified drug;population abundance;biodiversity;carbon;dinoflagellate;oxygen;carbon dioxide;calcification;antioxidant;Symbiodinium;amino acid;mycosporine like amino acid;pigment;fluorescent protein;acclimation;ecophysiology;light quality;peptides and proteins;photobiology;photochemical quenching;photosynthetic photon flux density;scleractinian corals;photophysiology;photoprotection,,
rayyan-296974376,Novel tools integrating metabolic and gene function to study the impact of the environment on coral symbiosis,2014,,,Frontiers in Microbiology,1664302X,5,,,"Pernice, M. and Levy, O.",https://www.scopus.com/inward/record.uri?eid=2-s2.0-84987781489&doi=10.3389%2ffmicb.2014.00448&partnerID=40&md5=e425497af8f434601905223b922660cb,English,,,"The symbiotic dinoflagellates (genus Symbiodinium) inhabiting coral endodermal tissues are well known for their role as keystone symbiotic partners, providing corals with enormous amounts of energy acquired via photosynthesis and the absorption of dissolved nutrients. In the past few decades, corals reefs worldwide have been increasingly affected by coral bleaching (i.e., the breakdown of the symbiosis between corals and their dinoflagellate symbionts), which carries important socio-economic implications. Consequently, the number of studies focusing on the molecular and cellular processes underlying this biological phenomenon has grown rapidly, and symbiosis is now widely recognized as a major topic in coral biology. However, obtaining a clear image of the interplay between the environment and this mutualistic symbiosis remains challenging. Here, we review the potential of recent technological advances in molecular biology and approaches using stable isotopes to fill critical knowledge gaps regarding coral symbiotic function. Finally, we emphasize that the largest opportunity to achieve the full potential in this field arises from the integration of these technological advances. © 2014 Pernice and Levy.","Publisher: Frontiers Media S.A. | RAYYAN-INCLUSION: {""Samantha""=>""Included""} | RAYYAN-LABELS: extracted",,coral;nonhuman;Article;oxidative stress;protein expression;photosynthesis;symbiosis;environmental change;genomics;temperature stress;fluorescence in situ hybridization;Symbiodinium;apoptosis;gene function;sequence analysis;molecular biology;next generation sequencing;endoplasmic reticulum associated degradation;light stress;unfolded protein response;stable isotopes,,
rayyan-296974379,The immune responses of the coral,2014,,,Invertebrate Survival Journal,1824307X,11,,319--328,"Toledo-Hernández, C. and Ruiz-Diaz, C.P.",https://www.scopus.com/inward/record.uri?eid=2-s2.0-84930668902&partnerID=40&md5=9680777b7ca12dd3203b1adecc7fafdc,English,,,"Corals are among the most ancient extant animals on earth. Currently, coral viability is threatened, due in part to the increased number of diseases affecting them in recent decades. Understanding how the innate immune systems of corals function is important if we want to predict the fate of corals and their response to the environmental and biological changes they face. In this review we discuss the latest findings regarding the innate immune systems of corals. The review is organized following the chronology of steps taken by corals from the initial encounter with a potential pathogen and recognition of threats to the orchestration of a response. We begin with the literature describing the repertory of immune-related receptors involved in the recognition of threats and the subsequent pathways leading to an immune response. We then review the effector responses that eliminate the threats described for corals. Finally, we acknowledge the literature of coral microbiology to access the potential role of microbes as an essential constituent of the coral immune system. © 2014 Universita degli Studi di Modena e Reggio Emilia. All rights reserved.","Publisher: Universita degli Studi di Modena e Reggio Emilia | RAYYAN-INCLUSION: {""Samantha""=>""Included""} | RAYYAN-LABELS: extracted",,Anthozoa;Animalia;immune response;afferent and effector arms;coral diseases;coral-associated microbes,,
rayyan-296974386,Keeping the ‘{Great}’ in the {Great} {Barrier} {Reef}: {Large}-scale governance of the {Great} {Barrier} {Reef} {Marine} {Park},2014,,,International Journal of the Commons,18750281,8,2,396--427,"Evans, L.S. and Ban, N.C. and Schoon, M. and Nenadovic, M.",https://www.scopus.com/inward/record.uri?eid=2-s2.0-84907016181&doi=10.18352%2fijc.405&partnerID=40&md5=80b6019da95259ed0e52fd1d565e9ec5,English,,,"As part of an international collaboration to compare large-scale commons, we used the Social-Ecological Systems Meta-Analysis Database (SESMAD) to systematically map out attributes of and changes in the Great Barrier Reef Marine Park (GBRMP) in Australia. We focus on eight design principles from common-pool resource (CPR) theory and other key social-ecological systems governance variables, and explore to what extent they help explain the social and ecological outcomes of park management through time. Our analysis showed that commercial fisheries management and the re-zoning of the GBRMP in 2004 led to improvements in ecological condition of the reef, particularly fisheries. These boundary and rights changes were supported by effective monitoring, sanctioning and conflict resolution. Moderate biophysical connectivity was also important for improved outcomes. However, our analysis also highlighted that continued challenges to improved ecological health in terms of coral cover and biodiversity can be explained by fuzzy boundaries between land and sea, and the significance of external drivers to even large-scale social-ecological systems (SES). While ecological and institutional fit in the marine SES was high, this was not the case when considering the coastal SES. Nested governance arrangements become even more important at this larger scale. To our knowledge, our paper provides the first analysis linking the re-zoning of the GBRMP to CPR and SES theory. We discuss important challenges to coding large-scale systems for meta-analysis. © 2014 Igitur publishing. All rights reserved.","Publisher: Igitur, Utrecht Publishing and Archiving Services | RAYYAN-INCLUSION: {""Patrice""=>""Included""} | RAYYAN-LABELS: extracted,CEESAT done,systematic map",,Great Barrier Reef;Coral reefs;fisheries;social-ecological system;marine;large-scale;Military Personnel,,
rayyan-296974403,Traditional vs new approaches for assessing coral health: {A} global overview and the paradigm of {French} polynesia,2014,,,Journal of Marine Science and Technology (Taiwan),10232796,22,1,25--35,"Hédouin, L. and Berteaux-Lecellier, V.",https://www.scopus.com/inward/record.uri?eid=2-s2.0-84901783096&doi=10.6119%2fJMST-013-0813-2&partnerID=40&md5=aa96996247fe4cb6a1f2cd0d2bb2bf9a,English,,,"Today, there is increasing concern regarding the capacity of Scleractinian corals to sustain the growing number of insults associated with global and local changes (e.g. global warming, ocean acidification, pollution). If corals are to exist, there is an urgent need to use indicators of coral health that provide insight into early sub lethal shifts in corals before the irreversible effects of exposure manifest at the population and community levels. This paper will provide an overview of the most relevant and appropriate indicators of coral health currently used in traditional monitoring programs (traditional approach) or those that could be used in a near future to improve assessment of coral health (new and proactive approach). In addition, by using French Polynesia coral reefs as a study case, this paper will present how coral health was assessed in the past and how it will be in a near future.","Publisher: National Taiwan Ocean University | RAYYAN-INCLUSION: {""Samantha""=>""Included""} | RAYYAN-LABELS: extracted",,Global warming;Health;Ocean acidifications;French Polynesia;stress;Indicators (instruments);Scleractinian corals;Traditional approaches;Coral heath;French polynesia;Irreversible effects;Monitoring programs;Pro-active approach;Stresses;coral heath;indicator,,
rayyan-296974407,Long-term change in coral cover and the effectiveness of marine protected areas in the {Philippines}: {A} meta-analysis,2014,,,Hydrobiologia,188158,733,1,5--17,"Magdaong, E.T. and Fujii, M. and Yamano, H. and Licuanan, W.Y. and Maypa, A. and Campos, W.L. and Alcala, A.C. and White, A.T. and Apistar, D. and Martinez, R.",https://www.scopus.com/inward/record.uri?eid=2-s2.0-84900445085&doi=10.1007%2fs10750-013-1720-5&partnerID=40&md5=be954aca1e5bce44862a681efa958594,English,,,"Although coral declines have been reported from major reefs of the world, region-specific trends still remain unclear, particularly in areas with high diversity such as the Philippines. We assessed the temporal patterns of the magnitude and trajectory of coral cover change in the Philippines using survey data collected from 317 sites. We examined the rate of change in coral cover in relation to time, effects of bleaching and protection against fishing and assessed the efficacy of marine protected areas (MPAs) using meta-analysis. Results showed an overall increase in coral cover in the Philippines from 1981 to 2010. Protection from fishing contributed to the overall increase in the mean annual rate of change as the coral cover significantly increased within MPAs than outside. The significant differences in the rate of coral cover change through time were influenced by chronic anthropogenic stresses, coinciding with the timing of thermal stress and the establishment of MPAs. The rate of change in coral cover was independent of the level of protection and the age and size of MPA. © 2013 Springer Science+Business Media Dordrecht.","Publisher: Kluwer Academic Publishers | RAYYAN-INCLUSION: {""Patrice""=>""Included""} | RAYYAN-LABELS: extracted,CEESAT done,meta-analysis",,coral;Anthozoa;meta-analysis;Meta-analysis;coral bleaching;Bleaching;fishing;Philippines;protected area;survey;long-term change;Marine protected areas;Coral cover;Military Personnel,,
rayyan-296974412,Evidence of {Large}-scale chronic eutrophication in the great {Barrier} {Reef}: {Quantification} of chlorophyll a thresholds for sustaining coral {Reef} communities,2014,,,Ambio,447447,43,3,361--376,"Bell, P.R.F. and Elmetri, I. and Lapointe, B.E.",https://www.scopus.com/inward/record.uri?eid=2-s2.0-84897992107&doi=10.1007%2fs13280-013-0443-1&partnerID=40&md5=5825eff795d4295efe19451bed3387ea,English,,,"Long-term monitoring data show that hard coral cover on the Great Barrier Reef (GBR) has reduced by \&gt;70 \% over the past century. Although authorities and many marine scientists were in denial for many years, it is now widely accepted that this reduction is largely attributable to the chronic state of eutrophication that exists throughout most of the GBR. Some reefs in the far northern GBR where the annual mean chlorophyll a (Chl a) is in the lower range of the proposed Eutrophication Threshold Concentration for Chl a ( 0.2-0.3 mg m-3) show little or no evidence of degradation over the past century. However, the available evidence suggests that coral diseases and the crown-of-thorns starfish will proliferate in such waters and hence the mandated eutrophication Trigger values for Chl a ( 0.4-0.45 mg m-3) will need to be decreased to 0.2 mg m-3 for sustaining coral reef communities. © 2013 Royal Swedish Academy of Sciences.","Publisher: Kluwer Academic Publishers | RAYYAN-INCLUSION: {""Samantha""=>""Included""} | RAYYAN-LABELS: extracted",,Environmental Monitoring;Australia;coral reef;Coral Sea;Great Barrier Reef;Queensland;Coral Reefs;animal;Animals;review;Anthozoa;Pacific Ocean;environmental monitoring;water pollution;chemistry;chlorophyll;Water Pollution;coral bleaching;Chlorophyll;concentration (composition);eutrophication;Eutrophication;phosphorus;methodology;time;Phosphorus;chlorophyll a;Time Factors;barrier reef;threshold,,
rayyan-296974414,A review of the role and function of microbes in coral reef ecosystem,2014,,,Chinese Journal of Applied Ecology,10019332,25,3,919--930,"Zhou, J. and Jin, H. and Cai, Z.-H.",https://www.scopus.com/inward/record.uri?eid=2-s2.0-84897126316&partnerID=40&md5=ce1890086780be7c5736a8d734d238d3,Chinese,,,"Coral reef is consisted with several kinds of reef-associated organisms, including coral, fish, benthos, algae and microbes, which is an important marine ecosystem. Coral reef lives in the oligotrophic environment, has very highly primary productivity and net productivity, and is called ""tropical rain forest in ocean"". In corals, diverse microorganisms exert a significant influence on biogeochemical and ecological processes, including food webs, organism life cycles, and nutrient cycling. With the development of molecular biology, the role of microorganisms in a coral system is becoming more outstanding. In this article, we reviewed current understanding on 1) the onset of coral-bacterial associations; 2) the characteristics of microbes in coral (specificity, plasticity and co-evolution); 3) the role and signal regulation of microbes in the health and disease of coral; and 4) the response mechanism of microbes for global climatic change and consequent effects, such as temperature rise, ocean acidification and eutrophication. The aims of this article were to summarize the latest theories and achievements, clear the mechanism of microbial ecology in coral reefs and provide a theoretical reference for better protection and maintaining the coral's biodiversity.","Publisher: Science Press | RAYYAN-INCLUSION: {""Patrice""=>""Included""} | RAYYAN-LABELS: extracted",,coral reef;ecological impact;marine ecosystem;food web;bacterium;benthos;microbial community;net primary production;eutrophication;nutrient cycling;literature review;acidification;coevolution;temperature effect;rainforest;global change;molecular ecology;oligotrophic environment,,
rayyan-296974422,Microbial functional genes associated with coral health and disease,2013,,,Diseases of Aquatic Organisms,1775103,107,2,161--171,"Pratte, Z.A.",https://www.scopus.com/inward/record.uri?eid=2-s2.0-84890411913&doi=10.3354%2fdao02664&partnerID=40&md5=e00037db99730b00ec813fd317d5edfb,English,,,"Both the incidence and prevalence of coral disease are rapidly increasing, and as a consequence, many studies involving coral microbial associates have been conducted. However, very few of these have considered microbial functional genes. This is an underutilized approach for studying coral disease etiology which is capable of revealing the molecular processes of the coral microbial community. This review presents a summary of the known microbial functional genes that have been linked to coral health and disease. Overall functional gene diversity tended to be lower in healthy corals than diseased or bleached corals, and respiration and photosynthesis functional genes appeared to be crucial to coral health. Genes associated with the nitrogen cycle were the most studied, were highly represented within the coral holobiont, and their expression often shifted in diseased or stressed individuals. Carbon metabolism, such as fatty acid and amino acid catabolism, also tended to shift in unhealthy corals. Genes associated with sulfite respiration as well as dimethylsulfoniopropionate degradation have been detected, although they have yet to be directly associated with coral disease. In addition, genes associated with xenobiotic degradation, antibiotic resistance, virulence, and oxidative stress may all be involved in maintaining coral health. However, the links between these functional genes and their roles in interacting with the coral host are not clear. Continuing identification of coral-associated microbial functional genes within the coral holobiont should facilitate advances in the field of coral health and disease. © Inter-Research 2013.","RAYYAN-INCLUSION: {""Samantha""=>""Included""} | RAYYAN-LABELS: extracted",,coral reef;biodegradation;microbial activity;photosynthesis;microbial community;carbon;gene expression;antibiotic resistance;carboxylic acid;Biogeochemical cycling;nitrogen cycle;catabolism;disease prevalence;genetic differentiation;respiration;Holobiont;Antibiotic resistance;Etiology;Functional diversity,,
rayyan-296974439,Acanthaster planci is a major cause of coral mortality in {Indonesia},2013,,,Coral Reefs,7224028,32,3,803--812,"Baird, A.H. and Pratchett, M.S. and Hoey, A.S. and Herdiana, Y. and Campbell, S.J.",https://www.scopus.com/inward/record.uri?eid=2-s2.0-84881260590&doi=10.1007%2fs00338-013-1025-1&partnerID=40&md5=38c05f510982afbf03b41c6254ca1c73,English,,,"The corallivorous crown-of-thorns starfish (COTS), Acanthaster planci, is recognised as a major cause of coral reef degradation throughout much of the Pacific Ocean. However, the effects of COTS on the high diversity reefs in Indonesia have been largely overlooked. In 2007, high densities of COTS were observed in two regions of Indonesia: Aceh and Halmahera. Densities of COTS ranged from 0 to 52 starfish 2,000 m2 across 24 sites in Aceh and from 0 to 18 starfish 2,000 m2 at 10 sites in Halmahera. Mortality rates of Acropora spp. were very high at affected sites: over 50 \% of colonies had been killed at seven of the 16 affected sites. A review of historical sources going back to 1969 suggests that COTS have damaged many reefs throughout Indonesia, including much activity within the Indonesian section of the Coral Triangle. Furthermore, the data suggest that COTS activity has increased rapidly since 2000. Very little of this activity has been reported in the primary literature, and there is a general lack of awareness in Indonesia of COTS as a potential cause of reef degradation. This lack of awareness, combined with limited monitoring efforts, means that damage caused by COTS is often attributed to other causes, such as destructive fishing, bleaching or tsunami. COTS are clearly a major source of coral mortality in Indonesia of which scientists and government need to be more cognizant. © 2013 Springer-Verlag Berlin Heidelberg.","RAYYAN-INCLUSION: {""Samantha""=>""Included""} | RAYYAN-LABELS: extracted",,Coral reef;coral;fish;Anthozoa;environmental monitoring;environmental degradation;coral bleaching;mortality;Acropora;predation;fishing;Coral Triangle;disturbance;Acanthaster planci;Mortality;damage;Indonesia;Asteroidea;Aceh;Halmahera;Moluccas;North Maluku;predation risk;Disturbance;Crown-of-thorns starfish;Predation,,
