key,title,year,month,day,journal,issn,volume,issue,pages,authors,url,language,publisher,location,abstract,notes,doi,keywords,pubmed_id,pmc_id
rayyan-296974695,"Extensive coral mortality in the {US} {Virgin} {Islands} in 2005/2006: {A} review of the evidence for synergy among thermal stress, coral bleaching and disease",2009,,,Caribbean Journal of Science,86452,45,2,204--214,"Rogers, C.S. and Muller, E. and Spitzack, T. and Miller, J.",https://www.scopus.com/inward/record.uri?eid=2-s2.0-79951570025&doi=10.18475%2fcjos.v45i2.a8&partnerID=40&md5=3ddc42eca7d060d5e30677fa7b0a6048,English,,,"In the summer/fall of 2005, extensive coral bleaching on reefs in the US Virgin Islands (USVI) was associated with sea water temperatures exceeding 30°C. Almost all coral species bleached, including Acropora palmata, which bleached for the first time on record in the USVI. As water temperatures cooled, corals began to regain their normal coloration. However, a severe disease outbreak then occurred on deeper, non-acroporid reefs. The disease demonstrated signs consistent with white plague. Monitoring of coral cover along previously established long-term transects on several reefs in St. John and St. Croix was intensified. Data on bleaching and disease were collected before, during and after this bleaching/disease episode. Average coral cover declined by over 50\%, from 21.4\% to 10.3\% at the long-term study sites, within one year of the onset of bleaching, declining further to 8.3\% after two years. This loss of coral cover was greater than from all other stressors affecting the USVI reefs in preceding years, and no significant recovery is evident. Disease prevalence increased on bleached A. palmata colonies that were being monitored as well as on the colonies of other species on the deeper reefs. Bleached A. palmata colonies had more disease (primarily white pox and other un-described diseases) than unbleached colonies. The non-acroporid corals that bleached most severely suffered the highest mortality from disease. Although the research summarized in this paper is not conclusive, the results suggest that high water temperatures lead to bleaching, which weakens corals and makes them more vulnerable to diseases. © 2009 College of Arts and Sciences.","Publisher: University of Puerto Rico | RAYYAN-INCLUSION: {""Samantha""=>""Included""} | RAYYAN-LABELS: extracted",,coral reef;seawater;Anthozoa;sea surface temperature;reef;coral bleaching;mortality;prevalence;Leeward Islands [Lesser Antilles];Virgin Islands;Virgin Islands (U.S.);monitoring system;Acropora palmata;temperature effect;disease prevalence;Acroporidae;Montastraea,,
rayyan-296974699,The current state of research in scleractinian coral-{Symbiodinium} symbiosis,2009,,,Shengtai Xuebao/ Acta Ecologica Sinica,10000933,29,8,4397--4407,"Zhou, G.-W. and Huang, H. and Yu, Z.-N. and Dong, Z.-J. and Li, Y.-C.",https://www.scopus.com/inward/record.uri?eid=2-s2.0-70349325645&partnerID=40&md5=37b09a5f25abb490b5da99c54fd8899f,Chinese,,,"Here, the current state of research in scleractinian coral-Symbiodinium symbiosis, the adaptability of Symbiodini-um associations to rapid environmental change,and symbiosis evolution is reviewed. Reef corals form associations with an array of genetically and physiologically distinct endosymbiontic dinoflagellates of the genus Symbiodinium. The relationship between zooxanthellae and scleractinian corals is an example of the evolutionary success of such a symbiotic association. Re-cent molecular phylogenetic studies on the symbionts of coral have revealed an extraordinary diversity of Symbiodinium linea-ges. Based upon nuclear ribosomal DNA (rDNA) gene polymorphisms, the genus Symbiodinium is currently recognized to comprise at least eight highly divergent phylogenetic clades or lineages (A to H) that in turn contain multiple molecular subclade types. Additional ecological and evolutionary studies have shown that the complexity of these symbiosis. Elucida-ting the specificity and flexibility between different Symbiodinium and host corals requires additional research. The health of the holobiont is very sensitive to changes in the environment such as elevated sea temperatures due to global climate change. The relationship between corals and Symbiodinium and the adaptability of holobiont are a key area for future research due to the critical challenges that corals, and the reefs they .build, face as a consequence of rapid climate change.","Publisher: Science Press | RAYYAN-INCLUSION: {""Samantha""=>""Included""} | RAYYAN-LABELS: extracted",,coral reef;climate change;Anthozoa;symbiosis;Scleractinia;adaptation;dinoflagellate;Dinophyceae;endosymbiont;global climate;research work;Symbiodinium;cladistics;evolutionary biology;DNA;global change,,
rayyan-296974700,Effects of solar ultraviolet radiation on coral reef organisms,2009,,,Photochemical and Photobiological Sciences,1474905X,8,9,1276--1294,"Banaszak, A.T. and Lesser, M.P.",https://www.scopus.com/inward/record.uri?eid=2-s2.0-69949086712&doi=10.1039%2fb902763g&partnerID=40&md5=97555021f922c095be51c273c5594204,English,,,"Organisms living in shallow-water tropical coral reef environments are exposed to high UVR irradiances due to the low solar zenith angles (the angle of the sun from the vertical), the natural thinness of the ozone layer over tropical latitudes, and the high transparency of the water column. The hypothesis that solar ultraviolet radiation (UVR, 290-400 nm) is an important factor that affects the biology and ecology of coral reef organisms dates only to about 1980. It has been previously suggested that increased levels of biologically effective ultraviolet B radiation (UVB, 290-320 nm), which is the waveband primarily affected by ozone depletion, would have relatively small effects on corals and coral reefs and that these effects might be observed as changes in the minimum depths of occurrence of important reef taxa such as corals. This conclusion was based on predictions of increases in UVR as well as its attenuation with depth using the available data on UVR irradiances, ozone levels, and optical properties of the water overlying coral reefs. Here, we review the experimental evidence demonstrating the direct and indirect effects of UVR, both UVB and ultraviolet A (UVA, 320-400 nm) on corals and other reef associated biota, with emphasis on those studies conducted since 1996. Additionally, we re-examine the predictions made in 1996 for the increase in UVB on reefs with currently available data, assess whether those predictions were reasonable, and look at what changes might occur on coral reefs in the future as the multiple effects (i.e. increased temperature, hypercapnia, and ocean acidification) of global climate change continue. © 2009 The Royal Society of Chemistry and Owner Societies.","Publisher: Royal Society of Chemistry | RAYYAN-INCLUSION: {""Samantha""=>""Included""} | RAYYAN-LABELS: extracted",,bleaching;coral reef;climate change;Animals;coral;nonhuman;review;marine species;Anthozoa;oxidative stress;ultraviolet radiation;Ultraviolet Rays;larval development;taxonomy;priority journal;evolutionary adaptation;global climate;biota;acidification;hypercapnia;reproduction;photooxidation;solar radiation;prediction;Marine Biology;DNA damage;biology;temperature acclimatization;optics;ozone depletion;Photobiology;ultraviolet A radiation;ultraviolet B radiation,,
rayyan-296974701,Coral reefs: {Threats} and conservation in an era of global change,2009,,,Annals of the New York Academy of Sciences,778923,1162,,136--186,"Riegl, B. and Bruckner, A. and Coles, S.L. and Renaud, P. and Dodge, R.E.",https://www.scopus.com/inward/record.uri?eid=2-s2.0-66149100153&doi=10.1111%2fj.1749-6632.2009.04493.x&partnerID=40&md5=78fb486f518d2ee0cf88c4c2a70cb124,English,,,"Coral reefs are iconic, threatened ecosystems that have been in existence for ∼500 million years, yet their continued ecological persistence seems doubtful at present. Anthropogenic modification of chemical and physical atmospheric dynamics that cause coral death by bleaching and newly emergent diseases due to increased heat and irradiation, as well as decline in calcification caused by ocean acidification due to increased CO2, are the most important large-scale threats. On more local scales, overfishing and destructive fisheries, coastal construction, nutrient enrichment, increased runoff and sedimentation, and the introduction of nonindigenous invasive species have caused phase shifts away from corals. Already ∼20\% of the world's reefs are lost and ∼26\% are under imminent threat. Conservation science of coral reefs is well advanced, but its practical application has often been lagging. Societal priorites, economic pressures, and legaladministrative systems of many countries are more prone to destroy rather than conserve coral-reef ecosystems. Nevertheless, many examples of successful conservation exist from the national level to community-enforced local action. When effectively managed, protected areas have contributed to regeneration of coral reefs and stocks of associated marine resources. Local communities often support coral-reef conservation in order to raise income potential associated with tourism andor improved resource levels. Coral reefs create an annual income in S-Florida alone of over \$4 billion. Thus, no conflict between development, societal welfare, and coral-reef conservation needs to exist. Despite growing threats, it is not too late for decisive action to protect and save these economically and ecologically high-value ecosystems. Conservation science plays a critical role in designing effective strategies. © 2009 New York Academy of Sciences.","ISBN: 9781573317535 Publisher: Blackwell Publishing Inc. | RAYYAN-INCLUSION: {""Samantha""=>""Included""} | RAYYAN-LABELS: extracted",,bleaching;coral reef;climate change;ecosystem;Ecosystem;animal;Animals;coral;nonhuman;review;Fisheries;fishery;sea water;Seawater;Anthozoa;environmental protection;United States;tourism;coastal waters;sea;Conservation of Natural Resources;biodiversity;greenhouse effect;carbon dioxide;acidification;fishing;runoff;sedimentation;Marine Biology;nutrient;food industry;heat;irradiation;species invasion;biology;global change;threat;Coral Reefs,,
rayyan-296974703,Coral-virus interactions: {A} double-edged sword?,2009,,,Symbiosis,3345114,47,1,1--8,"Van Oppen, M.J.H. and Leong, J.-A. and Gates, R.D.",https://www.scopus.com/inward/record.uri?eid=2-s2.0-62949152286&doi=10.1007%2fBF03179964&partnerID=40&md5=86c5c09cb384c96dafb07e78b31f1def,English,,,"Marine viruses were little studied until 1989, when they were discovered to be extremely abundant in the sea. Virology is now a growing field of science in coral reef research, largely related to an increase in the frequency of coral bleaching events and other coral diseases. Because viruses are obligate symbionts, they are generally perceived as parasitic and harmful to their hosts. However, evidence that viruses confer benefits to their hosts is growing and their role as mutualists is emerging. Here we review both the detrimental and beneficial aspects of viral infections and argue that as the field of coral virology expands, in addition to their pathogenicity, the idea that viruses represent functionally beneficial components of the coral holobiont be considered. © 2009 Balaban.","Publisher: Balaban Publishers | RAYYAN-INCLUSION: {""Samantha""=>""Included""} | RAYYAN-LABELS: extracted",,coral;Anthozoa;symbiosis;Scleractinia;coral bleaching;Coral bleaching;mutualism;parasitism;virus;infectious disease,,
rayyan-296974705,"Climate change and coral reef bleaching: {An} ecological assessment of long-term impacts, recovery trends and future outlook",2008,,,"Estuarine, Coastal and Shelf Science",2727714,80,4,435--471,"Baker, A.C. and Glynn, P.W. and Riegl, B.",https://www.scopus.com/inward/record.uri?eid=2-s2.0-57649111592&doi=10.1016%2fj.ecss.2008.09.003&partnerID=40&md5=690b19a7385aa04a88c3ae172647efa7,English,,,"Since the early 1980s, episodes of coral reef bleaching and mortality, due primarily to climate-induced ocean warming, have occurred almost annually in one or more of the world's tropical or subtropical seas. Bleaching is episodic, with the most severe events typically accompanying coupled ocean-atmosphere phenomena, such as the El Niño-Southern Oscillation (ENSO), which result in sustained regional elevations of ocean temperature. Using this extended dataset (25+ years), we review the short- and long-term ecological impacts of coral bleaching on reef ecosystems, and quantitatively synthesize recovery data worldwide. Bleaching episodes have resulted in catastrophic loss of coral cover in some locations, and have changed coral community structure in many others, with a potentially critical influence on the maintenance of biodiversity in the marine tropics. Bleaching has also set the stage for other declines in reef health, such as increases in coral diseases, the breakdown of reef framework by bioeroders, and the loss of critical habitat for associated reef fishes and other biota. Secondary ecological effects, such as the concentration of predators on remnant surviving coral populations, have also accelerated the pace of decline in some areas. Although bleaching severity and recovery have been variable across all spatial scales, some reefs have experienced relatively rapid recovery from severe bleaching impacts. There has been a significant overall recovery of coral cover in the Indian Ocean, where many reefs were devastated by a single large bleaching event in 1998. In contrast, coral cover on western Atlantic reefs has generally continued to decline in response to multiple smaller bleaching events and a diverse set of chronic secondary stressors. No clear trends are apparent in the eastern Pacific, the central-southern-western Pacific or the Arabian Gulf, where some reefs are recovering and others are not. The majority of survivors and new recruits on regenerating and recovering coral reefs have originated from broadcast spawning taxa with a potential for asexual growth, relatively long distance dispersal, successful settlement, rapid growth and a capacity for framework construction. Whether or not affected reefs can continue to function as before will depend on: (1) how much coral cover is lost, and which species are locally extirpated; (2) the ability of remnant and recovering coral communities to adapt or acclimatize to higher temperatures and other climatic factors such as reductions in aragonite saturation state; (3) the changing balance between reef accumulation and bioerosion; and (4) our ability to maintain ecosystem resilience by restoring healthy levels of herbivory, macroalgal cover, and coral recruitment. Bleaching disturbances are likely to become a chronic stress in many reef areas in the coming decades, and coral communities, if they cannot recover quickly enough, are likely to be reduced to their most hardy or adaptable constituents. Some degraded reefs may already be approaching this ecological asymptote, although to date there have not been any global extinctions of individual coral species as a result of bleaching events. Since human populations inhabiting tropical coastal areas derive great value from coral reefs, the degradation of these ecosystems as a result of coral bleaching and its associated impacts is of considerable societal, as well as biological concern. Coral reef conservation strategies now recognize climate change as a principal threat, and are engaged in efforts to allocate conservation activity according to geographic-, taxonomic-, and habitat-specific priorities to maximize coral reef survival. Efforts to forecast and monitor bleaching, involving both remote sensed observations and coupled ocean-atmosphere climate models, are also underway. In addition to these efforts, attempts to minimize and mitigate bleaching impacts on reefs are immediately required. If significant reductions in greenhouse gas emissions can be achieved within the next two to three decades, maximizing coral survivorship during this time may be critical to ensuring healthy reefs can recover in the long term. © 2008 Elsevier Ltd. All rights reserved.","RAYYAN-INCLUSION: {""Samantha""=>""Included""} | RAYYAN-LABELS: extracted,check full text",,coral reef;ecological impact;climate change;ecosystem;environmental factor;environmental stress;Anthozoa;El Nino-Southern Oscillation;Arabian Sea;Indian Ocean;coral bleaching;global warming;Pisces;concentration (composition);community structure;future prospect;survival;Persian Gulf;Symbiodinium;prediction;environmental disturbance;stress;zooxanthella;mitigation;community;disease;temperature effect;conservation;spawning;survivorship;elevation;recovery;reefs;zooxanthellae;forecast,,
rayyan-296974717,"Climate change, global warming and coral reefs: {Modelling} the effects of temperature",2008,,,Computational Biology and Chemistry,14769271,32,5,311--314,"Crabbe, M.J.C.",https://www.scopus.com/inward/record.uri?eid=2-s2.0-49949110305&doi=10.1016%2fj.compbiolchem.2008.04.001&partnerID=40&md5=f7d01c8eac735f39bfa0048378fc3b67,English,,,"Climate change and global warming have severe consequences for the survival of scleractinian (reef-building) corals and their associated ecosystems. This review summarizes recent literature on the influence of temperature on coral growth, coral bleaching, and modelling the effects of high temperature on corals. Satellite-based sea surface temperature (SST) and coral bleaching information available on the internet is an important tool in monitoring and modelling coral responses to temperature. Within the narrow temperature range for coral growth, corals can respond to rate of temperature change as well as to temperature per se. We need to continue to develop models of how non-steady-state processes such as global warming and climate change will affect coral reefs. © 2008 Elsevier Ltd. All rights reserved.","RAYYAN-INCLUSION: {""Samantha""=>""Included""} | RAYYAN-LABELS: extracted",,Climate change;ecosystem;Ecosystem;animal;Animals;Monitoring;Reefs;review;Offshore oil well production;sea water;Seawater;Anthozoa;Atmospheric temperature;physiology;Scleractinia;Oceans and Seas;sea;climate;Bleaching;Cleaning;Coral bleaching;Global warming;greenhouse effect;Symbiosis;Temperature;Landforms;temperature;Caribbean;Biological;biological model;Models;Climate;El Nino;Weather;High temperature;Scleractinian;SST;Coral reefs;Coral growth;Interdecadal;Climate control;Climates;Climatology;Effects of temperature;Great barrier reef;Greenhouse Effect;Growth;High Temperature;IPCC;Mathematical Models;Meteorology;Satellite;Sea-surface temperature;Steady-state processes;Temperature changing;Temperature ranges;Climate Change,,
rayyan-296974735,10th {Anniversary} {Review}: {A} changing climate for coral reefs,2008,,,Journal of Environmental Monitoring,14640325,10,1,21--29,"Lough, J.M.",https://www.scopus.com/inward/record.uri?eid=2-s2.0-37849023116&doi=10.1039%2fb714627m&partnerID=40&md5=15105f23803fc68c6c80ade092bc2df8,English,,,"Tropical coral reefs are charismatic ecosystems that house a significant proportion of the world's marine biodiversity. Their valuable goods and services are fundamental to the livelihood of large coastal populations in the tropics. The health of many of the world's coral reefs, and the goods and services they provide, have already been severely compromised, largely due to over-exploitation by a range of human activities. These local-scale impacts, with the appropriate government instruments, support and management actions, can potentially be controlled and even ameliorated. Unfortunately, other human actions (largely in countries outside of the tropics), by changing global climate, have added additional global-scale threats to the continued survival of present-day coral reefs. Moderate warming of the tropical oceans has already resulted in an increase in mass coral bleaching events, affecting nearly all of the world's coral reef regions. The frequency of these events will only increase as global temperatures continue to rise. Weakening of coral reef structures will be a more insidious effect of changing ocean chemistry, as the oceans absorb part of the excess atmospheric carbon dioxide. More intense tropical cyclones, changed atmospheric and ocean circulation patterns will all affect coral reef ecosystems and the many associated plants and animals. Coral reefs will not disappear but their appearance, structure and community make-up will radically change. Drastic greenhouse gas mitigation strategies are necessary to prevent the full consequences of human activities causing such alterations to coral reef ecosystems. © The Royal Society of Chemistry.","RAYYAN-INCLUSION: {""Samantha""=>""Included""} | RAYYAN-LABELS: extracted",,coral reef;climate change;environmental impact;marine environment;Animals;review;Anthozoa;sea;Conservation of Natural Resources;biodiversity;greenhouse effect;priority journal;water temperature;global climate;salinity;carbon dioxide;acidification;sea level;Animalia;Climate;Greenhouse Effect,,
rayyan-296974762,Western {Indian} {Ocean} coral communities: {Bleaching} responses and susceptibility to extinction,2007,,,Marine Ecology Progress Series,1718630,337,,1--13,"McClanahan, T.R. and Ateweberhan, M. and Graham, N.A.J. and Wilson, S.K. and Ruiz Sebastián, C. and Guillaume, M.M.M. and Bruggemann, J.H.",https://www.scopus.com/inward/record.uri?eid=2-s2.0-34548227784&doi=10.3354%2fmeps337001&partnerID=40&md5=172d099db427d48adc53cba05a217a16,English,,,"A field study of coral bleaching and coral communities was undertaken spanning 8 countries and ∼35° of latitude in 2005. This was combined with studies in southern Kenya and northeast Madagascar in 1998 and Mauritius in 2004 to develop a synoptic analysis of coral community structure, bleaching response, susceptibility of the communities to bleaching, and the relative risk of extinctions in western Indian Ocean coral reefs. Cluster analysis identified 8 distinct coral communities among the 91 sites sampled, with 2 distinct communities in northern South Africa and central Mozambique, a third in the central atolls of the Maldives, and 5 less differentiated groups, in a swath from southern Kenya to Mauritius, including Tanzania, the granitic islands of the Seychelles, northeast Madagascar, and Reunion. Massive Pontes, Pavona, and Pocillopora dominated the central and northern Indian Ocean sites and, from historical records, replaced dominance by Acropora and Montipora. From southern Kenya to Mauritius, coral communities were less disturbed, with Acropora and Montipora dominating, and a mix of subdominants including branching Pontes, Fungia, Galaxea, massive Pontes, Pocillopora, and Synarea. The survey identified an area from southernmost Kenya to Tanzania as having the least disturbed and highest diversity reefs, and as being a regional priority for management. Taxa vulnerable to future extinction based on their response to warm water, population density, and commonness include largely low-diversity genera with narrow environmental ranges, such as Gyrosmilia interrupta, Plesiastrea versipora, Plerogyra sinuosa, and Physogyra lichtensteini. © Inter-Research 2007.","RAYYAN-INCLUSION: {""Samantha""=>""Included""} | RAYYAN-LABELS: extracted",,climate change;seawater;Anthozoa;remote sensing;Indian Ocean;coral bleaching;biodiversity;Acropora;community structure;water temperature;Pocillopora;Mascarene Islands;Mauritius;population density;monitoring;Indian Ocean islands;species diversity;Africa;Kenya;Tanzania;Maldives;Madagascar;Seychelles;ENSO;Reunion;Southern Africa;Sub-Saharan Africa;East Africa;extinction risk;Fungia;Galaxea;Gyrosmilia interrupta;metapopulation;Montipora;Mozambique;Pavona;Physogyra lichtensteini;Plerogyra sinuosa;Plesiastrea versipora;Synarea;degree heating weeks;meta-population;seawater temperature,,
